IssueID,StepNumber,StepName,Severity,IssueTitle,FileLocation,Category,TechnicalIssue,Impact,Recommendation,Status,Triage,AI Fixable,Notes
STEP25-CRIT-003,25,Final Recommendations and Summary,Critical,Xbox Accessibility Guidelines Implementation Required,Complete UI and interaction system,Accessibility,Zero Xbox Accessibility Guidelines implementation,Xbox certification requirement inclusive user experience,Implement comprehensive accessibility infrastructure,Active,High,9,Xbox certification blocker accessibility mandatory
STEP18-HIGH-002,18,Performance Analysis,HIGH,Synchronous Token Retrieval Bottleneck,Source/PlayFabGameSave/Source/Common/GameSaveHttpClient.cpp:lines 90-95,Performance,Each request blocks on token retrieval preventing request pipelining,50-200ms latency per operation,Implement asynchronous token caching with background refresh,,,5,Performance bottleneck
STEP18-HIGH-003,18,Performance Analysis,HIGH,Registry Access Performance Penalty,Source/PlayFabGameSave/Source/Platform/GDK/Platform_GDK.cpp:lines 21-25,Performance,Registry operations on every provider instantiation,50-100ms delay on cold startup,Cache registry results with change notification for updates,,,4,Platform performance issue
STEP18-MED-001,18,Performance Analysis,MEDIUM,Memory Copy Pattern Inefficiency,Source/PlayFabGameSave/Source/Platform/Win32/PFGameSaveFilesAPIProvider_Win32.cpp:lines 147,Performance,Raw memcpy with size calculation creates unnecessary memory touches,Inefficient memory operations,Use std::string assignment or move semantics for direct assignment,,,3,Memory optimization
STEP18-MED-002,18,Performance Analysis,MEDIUM,Exception Handling Overhead,Source/PlayFabGameSave/Source/Platform/Win32/PFGameSaveFilesAPIProvider_GRTS.cpp:lines 296; 489,Performance,Generic exception handling adds 10-20% overhead to platform API calls,Performance degradation in platform operations,Use error codes instead of exceptions for common failures,,,4,Performance optimization
