IssueID,StepNumber,StepName,Severity,IssueTitle,FileLocation,Category,TechnicalIssue,Impact,Recommendation,Status,Triage,AI Fixable,Notes
STEP01-MED-001,1,Project Structure Overview,MEDIUM,Build Configuration Documentation Gap,Build/PlayFabGameSave.Win32.props:lines 1-50; Build/PlayFabGameSave.GDK.props:lines 1-40,Documentation,Build configuration files lack inline documentation explaining platform-specific choices and compilation flags,Increases onboarding time for new developers and makes build troubleshooting more difficult,Add XML comments explaining each configuration section and platform-specific rationale,,,2,Affects developer productivity
STEP01-MED-002,1,Project Structure Overview,MEDIUM,External Dependency Management Manual Process,External/cgmanifest.json:lines 1-50,Code Quality,Manual dependency tracking without automated update checking or vulnerability scanning,Potential security vulnerabilities from outdated dependencies; manual effort required for updates,Integrate with automated dependency scanning tools (e.g. GitHub Dependabot; vcpkg with version constraints),,,6,Security risk from outdated dependencies
STEP01-LOW-001,1,Project Structure Overview,LOW,API Implementation File Size,Source/PlayFabGameSave/Source/Api/PFGameSaveFilesAPI.cpp:lines 1-2000+,Code Quality,Single large file (>2000 lines) contains all API implementations reducing maintainability,Harder to review changes; merge conflicts more likely; single file responsible for entire API surface,Split into logical modules (e.g. PFGameSaveInit.cpp; PFGameSaveOperations.cpp; PFGameSaveUI.cpp) with shared header for common definitions,,,7,Technical debt affecting maintainability
STEP02-CRIT-001,2,Public API Interface Analysis,CRITICAL,Type Safety Disaster in PFGameSaveInitArgs,Source/PlayFabGameSave/Include/playfab/gamesave/PFGameSaveFilesTypes.h:lines 45-50,Security,Type mismatch between field type (uint64_t) and enum type (uint32_t) will cause undefined behavior when enum grows,Runtime bugs; potential memory corruption; Xbox certification failure,Change options field to uint32_t to match enum type,,,1,Xbox certification blocker
STEP02-CRIT-002,2,Public API Interface Analysis,CRITICAL,Buffer Overflow Risk in Fixed Arrays,Source/PlayFabGameSave/Include/playfab/gamesave/PFGameSaveFilesTypes.h:lines 78-85,Security,Fixed-size character arrays with no bounds checking are buffer overflow vulnerabilities,Security vulnerability; potential remote code execution; Xbox certification blocker,Add input validation and use safer string handling patterns,,,5,Critical security vulnerability
STEP02-HIGH-001,2,Public API Interface Analysis,HIGH,Excessively Verbose Function Names Hurt Developer Experience,Source/PlayFabGameSave/Include/playfab/gamesave/PFGameSaveFiles.h:lines 45-78,Code Quality,Function names are excessively verbose (35-51 characters) making code unreadable and difficult to use,Poor developer experience; reduced code readability; increased typing burden,Provide shorter aliases like AddUser(); SetDeviceResponse() while maintaining clarity,,,2,Developer productivity impact
STEP02-HIGH-002,2,Public API Interface Analysis,HIGH,Antiquated Buffer-Based String APIs,Source/PlayFabGameSave/Include/playfab/gamesave/PFGameSaveFiles.h:lines 123-130,Code Quality,Two-call pattern requiring manual memory management for simple string return,Forces error-prone manual memory management; poor usability for modern C++ development,Provide modern string-based APIs or internal allocation with cleanup callbacks,,,8,Poor developer experience
STEP02-HIGH-003,2,Public API Interface Analysis,HIGH,Missing Critical Batch Operations,No batch operations found in API surface,Architecture,No atomic multi-file upload/download operations available,Games cannot atomically save multiple related files; potential data corruption during partial failures,Add PFGameSaveFilesBatchUpload() and PFGameSaveFilesBatchDownload() APIs,,,9,Data integrity risk
STEP02-HIGH-004,2,Public API Interface Analysis,HIGH,Path Injection Security Risk,Source/PlayFabGameSave/Include/playfab/gamesave/PFGameSaveFilesTypes.h:lines 47-48,Security,saveFolder parameter has no documented validation - could allow path traversal attacks,Potential security vulnerability allowing access to unauthorized directories,Implement and document path validation to prevent directory traversal attacks,,,4,Security vulnerability
STEP02-MED-001,2,Public API Interface Analysis,MEDIUM,Documentation Inconsistencies in Error Handling,Documentation for E_PF_GAMESAVE_DISK_FULL error code,Documentation,Error code docs suggest calling PFGameSaveFilesUploadWithUiAsync again for disk full error which makes no logical sense,Developer confusion; potential infinite retry loops,Correct documentation to suggest proper disk space management,,,1,Documentation quality issue
STEP02-MED-002,2,Public API Interface Analysis,MEDIUM,Fire-and-Forget UI Callback Design Flaw,Source/PlayFabGameSave/Include/playfab/gamesave/PFGameSaveFilesUi.h:lines 15-45,Architecture,Callbacks are fire-and-forget with no way to query current state outside callback context,Difficult to implement custom UI or state recovery after callback errors,Provide state query APIs for current sync status and UI state,,,8,Usability limitation
STEP02-MED-003,2,Public API Interface Analysis,MEDIUM,Artificial State Management Limitations,API documentation for PFGameSaveFilesAddUserWithUiAsync,Architecture,Can only be called once per user limitation forces expensive full reinitialization for re-sync,Poor performance; unnecessary complexity for multi-user scenarios,Allow user re-sync without full system teardown,,,9,Performance limitation
STEP02-LOW-001,2,Public API Interface Analysis,LOW,Missing API Version Information,Source/PlayFabGameSave/Include/playfab/gamesave/PFGameSaveFiles.h header,Documentation,No API versioning in headers makes evolution difficult,Difficulty managing API evolution and backward compatibility,Add version macros and API version query functions,,,2,Maintenance issue
STEP02-LOW-002,2,Public API Interface Analysis,LOW,Inconsistent Parameter Naming Conventions,Various API functions throughout headers,Code Quality,Sometimes saveRootFolderSize; sometimes just jsonSize - inconsistent naming,Minor developer confusion; reduced code consistency,Standardize parameter naming conventions across all APIs,,,4,Code consistency issue
STEP02-LOW-003,2,Public API Interface Analysis,LOW,Missing const Correctness,Multiple read-only parameters across API surface,Code Quality,Many read-only parameters should be marked const but aren't,Missed optimization opportunities; unclear parameter semantics,Add const qualifiers to all read-only parameters,,,1,Code quality issue
STEP03-CRIT-001,3,Platform Support Analysis,CRITICAL,Registry Access Security Vulnerability,Source/PlayFabGameSave/Source/Platform/GDK/Platform_GDK.cpp:lines 15-42,Security,Registry operations can throw Windows structured exceptions (SEH) which are not caught by std::exception handlers leading to potential crashes and resource leaks,Application crashes on Xbox consoles when registry access fails; violating Xbox certification requirements for stability,Use RAII pattern with proper SEH exception handling or __try/__except blocks,,,6,Xbox certification blocker
STEP03-CRIT-002,3,Platform Support Analysis,CRITICAL,Platform Detection Logic Fragility,Build/PlayFabGameSave.GDK/PlayFabGameSave.GDK.vcxproj:lines 35-39,Architecture,Uses MSBUILD_GUESS pattern which is inherently unreliable and mixes HC_PLATFORM and PF_GAMESAVE macro systems inconsistently,Platform misdetection could lead to wrong API provider selection causing runtime failures on target platforms,Implement deterministic platform detection using compiler-defined macros or runtime platform queries,,,7,Platform reliability risk
STEP03-CRIT-003,3,Platform Support Analysis,CRITICAL,Missing Error Recovery in Platform Provider Selection,Source/PlayFabGameSave/Source/Platform/GDK/Platform_GDK.cpp:lines 45-62,Architecture,No error handling for platform API failures; registry crashes propagate to caller; missing validation of provider creation,Application crashes during initialization if platform detection fails; violating Xbox reliability requirements,Add comprehensive error handling with fallback provider selection and validation,,,6,Xbox certification blocker
STEP03-HIGH-001,3,Platform Support Analysis,HIGH,Memory Management Pattern Inconsistency,Source/PlayFabGameSave/Source/Platform/Win32/PFGameSaveFilesAPIProvider_Win32.cpp:lines 142-150,Security,Uses raw memcpy without bounds checking beyond size validation; mixing C-style memory operations with C++ string management,Potential buffer overruns if folder string contains embedded nulls or size calculation is incorrect,Use secure string copying functions like strcpy_s or proper C++ string operations,,,3,Buffer overflow risk
STEP03-HIGH-002,3,Platform Support Analysis,HIGH,Platform-Specific Code Leakage in Common Areas,Build/PlayFabGameSave.GDK/PlayFabGameSave.GDK.vcxproj:lines 11-13,Architecture,GDK build includes Win32 platform files creating confusing platform abstraction boundaries,Makes platform-specific debugging difficult; increases maintenance complexity; potential for cross-platform contamination,Create clear platform abstraction with separate implementation files for each platform,,,5,Architecture violation
STEP03-HIGH-003,3,Platform Support Analysis,HIGH,Inadequate Exception Safety in Platform Operations,Source/PlayFabGameSave/Source/Platform/Win32/PFGameSaveFilesAPIProvider_GRTS.cpp:lines 296-489,Code Quality,Uses generic exception-to-HRESULT conversion without proper cleanup or platform-specific error translation,Platform-specific failures get generic error codes making debugging difficult and potentially hiding critical issues,Implement platform-specific exception handling with proper error code mapping,,,6,Debugging difficulty
STEP03-MED-001,3,Platform Support Analysis,MEDIUM,Build Configuration Duplication and Inconsistency,Build/PlayFab.C.GDK.props vs Build/PlayFab.C.Win32.props,Code Quality,Near-identical build configurations with slight differences that could cause platform-specific issues,Maintenance overhead; potential for configuration drift between platforms,Extract common build patterns to shared .props files,,,4,Maintenance issue
STEP03-MED-002,3,Platform Support Analysis,MEDIUM,Platform User State Management Complexity,Source/PlayFabGameSave/Source/Platform/Win32/PFGameSaveFilesAPIProvider_GRTS.cpp:lines 23-35,Code Quality,Fixed buffer sizes and untyped pointers create potential for buffer overruns and type safety issues,Path length limitations could cause failures; void* pointers reduce type safety,Use dynamic string allocation and typed handles,,,5,Type safety issue
STEP03-LOW-001,3,Platform Support Analysis,LOW,Resource File Versioning Manual Maintenance,Build/PlayFabGameSave.GDK/PlayFabGameSaveGDKVersionInfo.rc,Code Quality,Platform-specific version resources are manually maintained,Risk of version mismatches between platforms,Automate version resource generation from single source,,,3,Maintenance issue
STEP04-CRIT-001,4,API Layer Review,CRITICAL,Missing Parameter Validation in Initialize Function,Source/PlayFabGameSave/Source/Api/PFGameSaveFilesAPI.cpp:lines 30-44,Security,The function checks args != nullptr only for backgroundQueue access but doesn't validate args itself before calling args->options and later passing args to Initialize(),Potential null pointer dereference crash if called with nullptr args; Xbox certification failure,Add RETURN_HR_INVALIDARG_IF_NULL(args); at the function beginning,,,3,Xbox certification blocker
STEP04-CRIT-002,4,API Layer Review,CRITICAL,Inconsistent Async Parameter Validation,Source/PlayFabGameSave/Source/Api/PFGameSaveFilesAPI.cpp:lines 47-54; 323-329,Security,Inconsistent parameter validation across async functions - some validate localUserHandle but none validate XAsyncBlock* parameters,Potential crashes from null async blocks; Xbox certification failure,Add consistent RETURN_HR_INVALIDARG_IF_NULL(async); validation to all async functions,,,2,Xbox certification blocker
STEP04-HIGH-001,4,API Layer Review,HIGH,Missing Size Validation for Buffer Operations,Source/PlayFabGameSave/Source/Api/PFGameSaveFilesAPI.cpp:lines 275-281,Security,Validates buffer pointer but not size parameter - could lead to buffer overruns,Potential buffer overflow if jsonSize is 0 or extremely large,Add validation like if (jsonSize == 0) return E_INVALIDARG;,,,2,Buffer overflow risk
STEP04-MED-001,4,API Layer Review,MEDIUM,Debug Function Security in Release Builds,Source/PlayFabGameSave/Source/Api/PFGameSaveFilesForDebug.h:lines 8-38,Security,Debug functions are exposed via PF_API but may be available in release builds,Potential security risk if debug functions remain active in production,Wrap debug functions with #ifdef _DEBUG or similar build guards,,,3,Security risk in production
STEP04-MED-002,4,API Layer Review,MEDIUM,Inconsistent noexcept Specification,Source/PlayFabGameSave/Source/Api/PFGameSaveFilesAPI.cpp:lines 30; 77; 194; 200,Code Quality,Inconsistent noexcept specifications across similar API functions,Potential ABI issues and inconsistent exception guarantees,Add noexcept to all public API functions for consistency,,,2,ABI consistency issue
STEP05-CRIT-001,5,Common Components Review,CRITICAL,Custom PRNG Security Vulnerability,Source/PlayFabGameSave/Source/Common/Utils.cpp:lines 9-19,Security,Linear Congruential Generator with timestamp seed is cryptographically broken,GUIDs can be predicted/reproduced; potential security vulnerability for save file naming,Replace with BCryptGenRandom() or secure Windows Crypto API,,,5,Critical security vulnerability
STEP05-HIGH-001,5,Common Components Review,HIGH,Atomic Memory Ordering Performance Issue,Source/PlayFabGameSave/Source/Common/GameSaveGlobalState.cpp:line 40,Performance,Uses default memory_order_seq_cst which is unnecessarily expensive on ARM platforms,Performance overhead in singleton access patterns especially on Xbox Series S/X,Use memory_order_acquire/memory_order_release for better performance,,,4,Xbox performance issue
STEP05-MED-001,5,Common Components Review,MEDIUM,Magic Numbers Without Named Constants,Source/PlayFabGameSave/Source/Common/Utils.cpp:lines 17; 47-48,Code Quality,Hardcoded constants without explanatory names or comments,Reduced code maintainability and understanding,Extract to named constants with explanatory comments,,,2,Maintainability issue
STEP05-MED-002,5,Common Components Review,MEDIUM,Error Handling Gaps in Utility Functions,Source/PlayFabGameSave/Source/Common/Utils.cpp:lines 25-30,Code Quality,Some utility functions lack comprehensive error checking for edge cases,Potential runtime failures with unusual input values,Add validation and proper error propagation,,,4,Runtime reliability issue
STEP05-LOW-001,5,Common Components Review,LOW,Inconsistent Documentation Standards,Various utility modules throughout Common directory,Documentation,Mixed documentation styles and comment formatting across utility modules,Reduced code maintainability and developer experience,Standardize on consistent documentation format,,,1,Documentation quality issue
STEP06-MED-001,6,Generated Code Review,MEDIUM,Manual Coordination Required for API Updates,Utilities/Scripts/pf-gensdk.cmd:lines 82-88,Code Quality,Process depends on manual coordination with PlayFab Data service team for API spec updates,Risk of outdated API definitions if coordination fails; potential API version mismatches,Implement automated API spec synchronization or CI/CD integration with PlayFab service team,,,6,Maintenance automation issue
STEP07-CRIT-001,7,Platform-Specific Implementation Review,CRITICAL,Unsafe Registry Access with Incomplete Exception Handling,Source/PlayFabGameSave/Source/Platform/GDK/Platform_GDK.cpp:lines 12-42,Security,Registry handle is closed early on success path but not protected by RAII; exception handling only catches std::exception but not Windows SEH exceptions; potential handle leak on certain error paths,Resource leak potential; inadequate exception coverage could crash on registry failures,Use RAII pattern with unique_ptr custom deleter or ensure exception-safe resource management,,,6,Xbox certification blocker
STEP07-CRIT-002,7,Platform-Specific Implementation Review,CRITICAL,Missing Parameter Validation in Platform Providers,Source/PlayFabGameSave/Source/Platform/Win32/PFGameSaveFilesAPIProvider_Win32.cpp:lines 11-26,Security,Function dereferences args->saveFolder without first validating that args is not null,Null pointer dereference crash if Initialize called with null args,Add RETURN_HR_INVALIDARG_IF_NULL(args); at function start,,,2,Xbox certification blocker
STEP08-CRIT-001,8,Service Wrappers Analysis,CRITICAL,Unsafe Thread Synchronization in Mock Service,Source/PlayFabGameSave/Source/Wrappers/GameSaveServiceMock.h:lines 49-52,Security,Static inline variables for thread synchronization primitives are dangerous - they may not be properly initialized across different translation units and can cause undefined behavior,Potential crashes deadlocks or undefined behavior in multi-threaded scenarios during testing,Move synchronization primitives to a singleton class or use Meyer's singleton pattern,,,6,Thread safety issue
STEP08-CRIT-002,8,Service Wrappers Analysis,CRITICAL,Global State Modification Without Synchronization,Source/PlayFabGameSave/Source/Wrappers/GameSaveServiceSelector.cpp:line 18,Security,Global variable useMocks modified without proper synchronization in multi-threaded environment,Race conditions during service selector initialization could cause undefined behavior,Add proper synchronization around useMocks flag modification and access,,,4,Thread safety issue
STEP08-HIGH-001,8,Service Wrappers Analysis,HIGH,Archive Context Exception Safety,Source/PlayFabGameSave/Source/Wrappers/GameSaveServiceMock.cpp:lines 127-129,Code Quality,Exception thrown during SharedPtr construction could leak allocated ArchiveContext,Memory leaks if constructor throws,Use make_shared equivalent or RAII guard,,,4,Memory leak risk
STEP08-HIGH-002,8,Service Wrappers Analysis,HIGH,Async Operation Parameter Validation Gaps,Multiple service wrapper functions in GameSaveServiceMock.h,Code Quality,Limited parameter validation before dispatching async operations,Invalid parameters could propagate to async operations causing crashes,Add comprehensive parameter validation at wrapper entry points,,,3,Runtime reliability issue
STEP08-MED-001,8,Service Wrappers Analysis,MEDIUM,Error Handling Consistency,Various wrapper methods across GameSaveServiceMock.cpp,Code Quality,Inconsistent error code mapping between mock and production services,Different error behavior between testing and production,Standardize error code mapping through common error translation layer,,,5,Testing consistency issue
STEP08-MED-002,8,Service Wrappers Analysis,MEDIUM,Resource Management in Mock Archives,Source/PlayFabGameSave/Source/Wrappers/GameSaveServiceMock.cpp:lines 200+,Code Quality,Archive file handles not always properly cleaned up in exception scenarios,Potential file descriptor leaks during error conditions,Implement RAII wrappers for archive file operations,,,4,Resource leak risk
STEP09-CRIT-001,9,Service Providers Analysis,CRITICAL,Trivial Provider Implementation Pattern,Source/PlayFabGameSave/Source/Providers/UploadAsyncProvider.cpp:lines 13-30,Architecture,Provider is nothing more than a pass-through wrapper to FolderSyncManager - no validation no provider-specific logic no parameter checking,Violates single responsibility principle; makes error tracking difficult; provides no abstraction value,Either eliminate the provider layer entirely or add meaningful provider-specific validation and logic,,,7,Architecture anti-pattern
STEP09-CRIT-002,9,Service Providers Analysis,CRITICAL,Entity Token Race Condition Vulnerability,Source/PlayFabGameSave/Source/Common/GameSaveHttpClient.cpp:lines 88-120,Security,Entity token is retrieved and immediately used without checking expiration or handling concurrent token refresh scenarios,Could cause authentication failures under high concurrency when multiple requests trigger token refresh simultaneously,Implement token caching with proper synchronization and expiration checking,,,6,Authentication vulnerability
STEP09-CRIT-003,9,Service Providers Analysis,CRITICAL,Missing Input Validation on Secret Key,Source/PlayFabGameSave/Source/Common/GameSaveHttpClient.cpp:lines 146-148,Security,Secret key is used directly without validation of format length or content,Malformed secret keys could cause authentication failures or potential security issues,Add secret key format validation and sanitization before use,,,3,Security vulnerability
STEP09-HIGH-001,9,Service Providers Analysis,HIGH,Suboptimal Compression Algorithm Choice,Source/PlayFabSharedInternal/Source/ArchiveOperations.cpp:lines 30-45,Performance,Uses libarchive's default compression which is not optimized for typical game save file patterns (small structured data),3x CPU overhead compared to specialized compression algorithms like LZ4 or Snappy for game saves,Implement specialized compression strategy based on file size and type analysis,,,6,Performance issue
STEP09-HIGH-002,9,Service Providers Analysis,HIGH,Retry Logic Lacks Jitter - Thundering Herd Risk,Source/PlayFabGameSave/Source/Common/GameSaveHttpClient.cpp:lines 75-77,Performance,Retry logic uses standard exponential backoff without jitter causing synchronized retries,Under service stress all clients retry simultaneously creating thundering herd problems,Add randomized jitter to retry intervals to distribute load,,,4,Service reliability issue
STEP09-HIGH-003,9,Service Providers Analysis,HIGH,No Certificate Pinning Implementation,Source/PlayFabGameSave/Source/Common/GameSaveHttpClient.cpp:lines 78-85,Security,No certificate pinning or custom certificate validation configured,Vulnerable to man-in-the-middle attacks if device's certificate store is compromised,Implement certificate pinning for PlayFab service endpoints,,,5,Security vulnerability
STEP09-MED-001,9,Service Providers Analysis,MEDIUM,Inconsistent Error Handling Pattern,Source/PlayFabGameSave/Source/Providers/DownloadAsyncProvider.cpp:lines 12-14,Code Quality,Different variable names for same validation concept across providers,Code maintainability issues and potential confusion during debugging,Standardize validation scope variable naming across all providers,,,2,Maintenance issue
STEP09-MED-002,9,Service Providers Analysis,MEDIUM,Hardcoded Platform Strings in URL Construction,Source/PlayFabGameSave/Source/Common/GameSaveHttpClient.cpp:lines 32-47,Code Quality,Platform identification is hardcoded and fragile to platform changes,Adding new platforms requires code changes in multiple locations,Centralize platform identification in a configurable mapping,,,3,Maintenance issue
STEP12-HIGH-001,12,Wrapper Components Review,HIGH,Limited Exception Handling in Async Operations,Source/PlayFabGameSave/Source/Wrappers/LocalUserLoginOperation.cpp,Code Quality,No exception handling around underlying C API calls despite noexcept specification,Unhandled exceptions could violate noexcept contract causing std::terminate,Add try-catch blocks to convert exceptions to HRESULT error codes,,,3,Exception safety issue
STEP12-HIGH-002,12,Wrapper Components Review,HIGH,JSON Parse Exception Handling Inconsistency,Source/PlayFabGameSave/Source/Wrappers/GameSaveServiceMock.cpp:lines 533-541,Code Quality,Only JSON parse exceptions caught other potential exceptions not handled,Other exceptions could escape and violate expected error handling patterns,Add comprehensive exception handling for all potential error sources,,,3,Exception safety issue
STEP12-HIGH-003,12,Wrapper Components Review,HIGH,Async Operation Memory Management Complexity,Multiple files using MakeUnique<> for async operations,Code Quality,Complex async operation chains with multiple unique_ptr transfers,Potential memory leaks if operation chains fail or are cancelled,Consider implementing operation cancellation and cleanup verification,,,5,Memory management complexity
STEP12-MED-001,12,Wrapper Components Review,MEDIUM,Type Wrapper Template Complexity,Source/PlayFabGameSave/Source/Wrappers/CoreTypes.h,Code Quality,Complex inheritance hierarchy with multiple interface implementations,Increased compilation time potential template instantiation errors,Consider simplifying wrapper hierarchy for commonly used types,,,4,Compilation performance issue
STEP12-MED-002,12,Wrapper Components Review,MEDIUM,Service Selector Pattern Global State,Source/PlayFabGameSave/Source/Wrappers/GameSaveServiceSelector.cpp,Code Quality,Global state management already identified in Step 8 analysis,Thread safety concerns in multi-threaded environments,Implement proper synchronization or make configuration immutable,,,4,Thread safety issue
STEP12-LOW-001,12,Wrapper Components Review,LOW,Performance Overhead in Debug Builds,Various wrapper files with extensive move operations,Performance,Debug builds may not optimize away all wrapper overhead,Slower performance in debug configurations,Add conditional fast paths for release builds,,,2,Debug performance issue
STEP13-MED-001,13,Test Infrastructure Review,MEDIUM,Limited Xbox Certification Coverage,Test/PlayFabGameSaveAutomatedTests/ directory structure analysis,Compliance,Xbox certification requires specific test scenarios (Quick Resume suspend/resume memory pressure accessibility) that are not comprehensively covered,Potential Xbox certification failures during submission process,Add dedicated test cases for XR_015 (Quick Resume) XR_048 (Memory management) and XR_125 (Save data integrity) requirements,,,5,Xbox certification risk
