IssueID,StepNumber,StepName,Severity,IssueTitle,FileLocation,Category,TechnicalIssue,Impact,Recommendation,Status,Triage,AI Fixable,Notes
STEP13-MED-002,13,Test Infrastructure Review,MEDIUM,Accessibility Testing Gap,Test/ directory - no accessibility-specific test files,Compliance,Xbox Accessibility Guidelines (XAG) compliance is required for Xbox certification but not tested,Potential accessibility compliance failures and user experience issues for disabled users,Implement automated accessibility tests for UI callback scenarios and keyboard navigation,,,6,Accessibility compliance risk
STEP13-MED-003,13,Test Infrastructure Review,MEDIUM,Localization Testing Limited,Test/PlayFabGameSaveAutomatedTests/ - no locale-specific test data,Compliance,No testing with non-ASCII characters different text encodings or locale-specific file paths,Potential failures in international markets with non-English file systems and text encoding,Add test cases with Unicode filenames emoji characters and various encoding formats (UTF-8 UTF-16),,,4,Internationalization risk
STEP13-LOW-001,13,Test Infrastructure Review,LOW,Performance Metrics Incomplete,Test/PlayFabGameSaveAutomatedTestsStress/Program.cs:lines 145-155,Code Quality,Only measures total test execution time not granular performance metrics for individual operations,Cannot detect performance regressions in specific API operations or file size handling,Add performance counters for upload/download speeds memory usage patterns and operation latency,,,3,Testing capability gap
STEP14-MED-001,14,Sample Applications Analysis,MEDIUM,Hardcoded Configuration Values,Samples/PlayFabGameSaveSample-Win32/game.cpp:lines 60-65,Code Quality,Configuration values are hardcoded instead of using configuration files or environment variables,Samples cannot be easily adapted for other PlayFab titles without code modifications,Implement configuration file loading (JSON) with fallback to hardcoded values for quick testing,,,3,Configuration management issue
STEP14-MED-002,14,Sample Applications Analysis,MEDIUM,Incomplete GDK Sample Implementation,Samples/PlayFabGameSaveSample-GDK/Game.cpp:lines 121; 159-176,Code Quality,GDK sample is primarily a DirectX template with minimal game save functionality,Limited demonstrative value for Xbox-specific game save scenarios and lifecycle management,Implement complete game save workflow with Xbox-specific features (Quick Resume suspend/resume),,,6,Sample completeness issue
STEP14-LOW-001,14,Sample Applications Analysis,LOW,Documentation Disclaimers Missing,Samples/PlayFabGameSaveSample-Win32/ and Samples/PlayFabGameSaveSample-SteamWin32/,Documentation,Console-based samples don't clearly indicate their demonstration-only nature,Developers might use console UI patterns inappropriately in production games,Add clear documentation about console UI being demonstration-only,,,1,Documentation clarity issue
STEP14-LOW-002,14,Sample Applications Analysis,LOW,Steam Deck Path Assumption,Samples/PlayFabGameSaveSample-SteamWin32/game.cpp:lines 67-71,Code Quality,Hardcoded Linux path may not work on all Steam configurations,Sample may fail on non-standard Steam installations,Add platform detection and appropriate default path selection,,,2,Platform compatibility issue
STEP15-MED-001,15,Build System Review,MEDIUM,Build Configuration Complexity,Build/PlayFab.C.paths.props:lines 15-25,Code Quality,Complex conditional import logic makes build troubleshooting difficult,Build failures can be hard to diagnose due to multiple fallback paths and conditional imports,Simplify import hierarchy and add more descriptive error messages for missing dependencies,,,4,Build maintainability issue
STEP15-MED-002,15,Build System Review,MEDIUM,Hardcoded Tool Versions,Pipelines/Tasks/vs2022-build.yml:lines 36-40,Code Quality,Hardcoded .NET version could become outdated or unsupported,Future builds may fail when the specified version is no longer available,Use variable-driven version management or latest stable version specification,,,3,Build dependency issue
STEP15-LOW-001,15,Build System Review,LOW,Manual GDK Version Management,Pipelines/Tasks/gdk-vs2022-build.yml:lines 32-38,Code Quality,GDK version management relies on external variable without validation,Potential build failures if GDK version is incompatible or unavailable,Add GDK version validation and compatibility checking,,,3,Build validation issue
STEP15-LOW-002,15,Build System Review,LOW,Resource File Versioning,Build/PlayFabGameSave.Win32/PlayFabGameSaveWin32VersionInfo.aps,Code Quality,Binary .aps files are not source control friendly,Version information changes are not easily reviewable,Consider moving to text-based resource generation,,,2,Source control issue
STEP16-HIGH-001,16,Documentation and Release Process,HIGH,Missing Release Notes Infrastructure,Repository root - no CHANGELOG.md or RELEASES.md or versioning documentation,Documentation,No systematic way to communicate changes breaking changes or migration steps to developers,Developers cannot understand what changed between versions increasing integration risk,Implement automated changelog generation integrated with Azure DevOps pipeline and version tagging,,,5,Developer experience issue
STEP16-HIGH-002,16,Documentation and Release Process,HIGH,Limited Migration Documentation,README.md and Utilities/ directory - no migration guides found,Documentation,Developers upgrading between SDK versions have no guidance on required changes,Difficult SDK upgrades leading to developer frustration and potential implementation errors,Create version-specific migration guides with code examples and breaking change documentation,,,6,Developer adoption risk
STEP16-MED-001,16,Documentation and Release Process,MEDIUM,Insufficient Troubleshooting Documentation,README.md:lines 350-386 - only basic debugging information,Documentation,Minimal troubleshooting guidance for common integration problems and error scenarios,Developers spend excessive time debugging common issues without proper guidance,Create comprehensive troubleshooting guide covering common integration errors authentication issues and platform-specific problems,,,4,Developer productivity issue
STEP16-MED-002,16,Documentation and Release Process,MEDIUM,Accessibility Documentation Gap,Repository-wide search found no accessibility documentation for developers,Documentation,No guidance on how to implement accessible game save features using the SDK,Games using the SDK may not meet Xbox Accessibility Guidelines (XAG) requirements,Add accessibility section to documentation covering keyboard navigation screen reader support and XAG compliance patterns,,,5,Accessibility compliance risk
STEP16-MED-003,16,Documentation and Release Process,MEDIUM,Localization Documentation Missing,No I18N/L10N documentation found in README.md or documentation directories,Documentation,No guidance on handling international characters Unicode support or localized save file naming,Games with international audiences may experience save file issues or compatibility problems,Document Unicode support international character handling and localized filename best practices,,,4,Internationalization risk
STEP16-LOW-001,16,Documentation and Release Process,LOW,API Documentation Dependencies,Utilities/Scripts/docs/GeneratingReferenceDocs.md:lines 45-74,Documentation,Some API documentation requires manual maintenance separate from automated generation,Risk of documentation becoming out of sync with actual implementation,Investigate improving Noggin tool to reduce manual documentation requirements,,,3,Documentation maintenance issue
STEP16-LOW-002,16,Documentation and Release Process,LOW,Platform-Specific Documentation Scattered,README.md:lines 24-150 - multiple platform sections with overlapping content,Documentation,Platform-specific information is mixed with general instructions making it harder to follow,Developers may miss platform-specific requirements or follow incorrect instructions,Reorganize documentation with clear platform-specific sections and quick-start guides,,,2,Documentation organization issue
STEP17-CRIT-001,17,Security Analysis,CRITICAL,Authentication Race Condition Vulnerability,Service provider authentication flow,Security,Entity token retrieved and immediately used without expiration validation; no synchronization for concurrent token refresh scenarios,Authentication failures under concurrency potential session hijacking,Implement thread-safe token management with atomic operations and expiration validation,,,7,Xbox certification blocker
STEP17-CRIT-002,17,Security Analysis,CRITICAL,Custom PRNG Vulnerability,Source/PlayFabSharedInternal/Source/Utils.cpp,Security,Custom PRNG implementation without cryptographic strength susceptible to prediction attacks,Predictable session tokens and authentication nonces; compromised game save encryption keys; replay attack vulnerabilities,Replace with platform-approved cryptographic random number generator (std::random_device),,,6,Critical security vulnerability
STEP17-CRIT-003,17,Security Analysis,CRITICAL,Input Validation Vulnerabilities,Multiple API parameter validation points,Security,Missing string length validation JSON input sanitization and file path validation,Buffer overflows injection attacks data corruption through malicious inputs,Implement comprehensive input validation with length limits encoding validation and content sanitization,,,5,Xbox certification blocker
STEP17-HIGH-001,17,Security Analysis,HIGH,Certificate Validation Weaknesses,HTTP client certificate validation logic,Security,Certificate validation may not verify complete certificate chain; missing certificate pinning for PlayFab endpoints,Man-in-the-middle attack vulnerability,Implement certificate pinning hostname verification and strict TLS settings,,,6,Security vulnerability
STEP17-HIGH-002,17,Security Analysis,HIGH,Memory Management Vulnerabilities,Native string operations and buffer management,Security,Complex object lifetime management without consistent RAII; direct memory operations without bounds checking,Memory corruption information disclosure use-after-free potential,Audit for memory vulnerabilities implement secure memory clearing add bounds checking,,,7,Memory safety issue
STEP17-HIGH-003,17,Security Analysis,HIGH,Error Information Disclosure,Error handling and logging mechanisms,Security,Error messages may include sensitive details like user IDs and tokens in logs,Information leakage to attackers,Implement secure error handling with sanitized error messages,,,3,Information disclosure risk
STEP18-CRIT-001,18,Performance Analysis,CRITICAL,Recursive Mutex Overhead,Source/PlayFabGameSave/Source/Providers/UploadAsyncProvider.cpp:line 14,Performance,Recursive mutex has 2-3x overhead vs regular mutex for this use case,Significantly impacts concurrent operation performance,Replace with regular mutex and restructure lock scoping,,,4,Performance bottleneck
STEP18-HIGH-001,18,Performance Analysis,HIGH,Compression Algorithm Inefficiency,Source/PlayFabSharedInternal/Source/ArchiveOperations.cpp:lines 30-45,Performance,libarchive's generic compression causes 300% CPU overhead vs specialized algorithms for small structured data,3x CPU overhead compared to specialized compression algorithms like LZ4 for game saves,Implement specialized compression strategy: LZ4 for files < 1MB keep libarchive for larger files,,,6,Performance optimization
STEP19-CRIT-001,19,Code Quality Assessment,Critical,Outstanding TODO Comments,Source/PlayFabGameSave/Source/SyncManager/UploadStep.cpp:444,Technical Debt,Upload cancellation not fully implemented with multiple TODO comments,Incomplete features create maintenance burden and missing functionality,Convert TODOs to tracked work items with implementation plans,Active,High,8,Critical missing functionality in production code
STEP19-CRIT-002,19,Code Quality Assessment,Critical,Excessive Function Name Length,Public API throughout SDK,API Design,Function names up to 51 characters making code unreadable,Poor developer experience and maintenance difficulty,Redesign API with shorter more intuitive names,Active,High,9,API usability crisis requiring major redesign
STEP19-HIGH-001,19,Code Quality Assessment,High,Complex Synchronization Logic,Source/PlayFabGameSave/Source/SyncManager/FolderSyncManager.cpp:201-300,Code Complexity,Nested loops with conditional logic for file processing,Difficult to test maintain and debug,Extract methods for different processing steps,Active,Medium,7,Complex nested logic needs decomposition
STEP19-MED-001,19,Code Quality Assessment,Medium,Inconsistent Exception Handling,Source/PlayFabGameSave/Source/Platform/Win32/PFGameSaveFilesAPIProvider_Win32.cpp:296,Error Handling,Generic exception catching without specific handling,Loss of specific error information and harder debugging,Use specific exception types and preserve error context,Active,Medium,6,Generic catch blocks losing error context
STEP19-MED-002,19,Code Quality Assessment,Medium,Magic Numbers Without Explanation,Source/PlayFabGameSave/Source/Common/Utils.cpp:17,Code Quality,Hardcoded constants like LCG constants without explanation,Code unclear and difficult to maintain,Extract to named constants with explanatory comments,Active,Medium,5,Hardcoded magic numbers reducing maintainability
STEP19-MED-003,19,Code Quality Assessment,Medium,Buffer Safety Concerns,Source/PlayFabGameSave/Source/Common/Utils.cpp:100-101,Security,Manual buffer management without bounds checking,Potential buffer overflow vulnerabilities,Add buffer bounds validation and safe manipulation patterns,Active,High,7,Buffer safety issues requiring validation
STEP20-CRIT-001,20,Extensibility and Future-Proofing,Critical,Complete Absence of Plugin Architecture,Repository-wide search - no plugin mechanisms found,Extensibility,Cannot extend functionality without source code modifications,Developers cannot customize behavior or add new storage providers,Implement plugin architecture with contracts for storage providers,Active,High,9,Zero extensibility without source modifications
STEP20-CRIT-002,20,Extensibility and Future-Proofing,Critical,No API Versioning Strategy,Source/PlayFabGameSave/Include/playfab/gamesave/PFGameSaveFiles.h:1-265,API Design,No mechanism to track API versions or manage breaking changes,Cannot evolve API without breaking existing code,Add API versioning macros and compatibility checking,Active,High,8,API evolution blocked without versioning
STEP20-HIGH-001,20,Extensibility and Future-Proofing,High,Hardcoded Enum Limits Prevent Extension,Source/PlayFabGameSave/Include/playfab/gamesave/PFGameSaveFilesTypes.h:99-106,API Design,Comment promises future options but structure prevents safe extension,Cannot add new initialization options without API breaking changes,Add reserved flag bits and version-aware option parsing,Active,Medium,6,Future extension blocked by design
STEP20-HIGH-002,20,Extensibility and Future-Proofing,High,Type Mismatch Blocks Future Extension,Source/PlayFabGameSave/Include/playfab/gamesave/PFGameSaveFilesTypes.h:122,API Design,Type mismatch between uint64_t field and uint32_t enum,Will cause crashes when options exceed 32-bit range,Make enum uint64_t or field uint32_t for consistency,Active,Medium,4,Type safety issue preventing extension
STEP20-HIGH-003,20,Extensibility and Future-Proofing,High,Missing Provider Abstraction,Source/PlayFabGameSave/Source/Providers/GameSaveServiceProvider.h:1-100,Architecture,Cannot swap storage providers or add new cloud providers,Locked to PlayFab service only cannot support other solutions,Create abstract IStorageProvider interface with implementations,Active,High,8,Storage provider extensibility blocked
STEP20-MED-001,20,Extensibility and Future-Proofing,Medium,Limited Configuration Extensibility,Source/PlayFabGameSave/Source/Common/GameSaveGlobalState.h:1-50,Configuration,Configuration hardcoded with no extension points,Cannot add new configuration options or feature flags,Add configuration provider interface and feature flag system,Active,Medium,6,Configuration system lacks extensibility
STEP21-CRIT-001,21,Xbox Certification Requirements,Critical,Missing Xbox Accessibility Guidelines Compliance,SDK-wide analysis - no accessibility code found,Accessibility,Complete absence of accessibility support infrastructure,Automatic Xbox certification failure - XAG compliance mandatory,Implement comprehensive accessibility framework before certification,Active,High,9,Xbox certification blocker - zero accessibility
STEP21-CRIT-002,21,Xbox Certification Requirements,Critical,Quick Resume State Persistence Missing,Platform-specific code - no Quick Resume implementation,Platform Integration,Xbox Series X|S Quick Resume feature not supported,Certification requirement violation for next-gen Xbox consoles,Implement Quick Resume state persistence APIs and lifecycle,Active,High,8,Next-gen Xbox console requirement violation
STEP21-CRIT-003,21,Xbox Certification Requirements,Critical,Xbox Game Bar Integration Absent,GDK platform implementation - no Game Bar code,Platform Integration,Missing integration with modern Xbox Game Bar overlay system,Modern Xbox platform requirement not met,Add Game Bar integration for screenshot recording social features,Active,High,8,Modern Xbox platform requirement missing
STEP21-HIGH-001,21,Xbox Certification Requirements,High,Incomplete Parental Controls Integration,Basic family settings detection but no enforcement,Parental Controls,Parental control restrictions not properly enforced,May fail certification testing for family-safe content,Implement comprehensive parental control restriction enforcement,Active,Medium,7,Family safety compliance incomplete
STEP21-HIGH-002,21,Xbox Certification Requirements,High,Limited Suspend Resume State Management,Source/PlayFabGameSave/Source/Platform/GDK/ - basic lifecycle,Platform Integration,Incomplete state persistence during suspend/resume cycles,Potential data loss during suspend/resume cycles,Enhance state persistence for all operations during suspend/resume,Active,Medium,6,Data loss risk during platform lifecycle
STEP21-HIGH-003,21,Xbox Certification Requirements,High,Storage Quota Management Insufficient,Basic storage tracking but no quota enforcement,Storage Management,No proper handling of Xbox storage limitations,Storage-related certification failures,Implement comprehensive storage quota management and enforcement,Active,Medium,6,Storage management compliance incomplete
STEP22-CRIT-001,22,Localization and Globalization,Critical,Missing Localization Infrastructure,Source/PlayFabGameSave/ entire codebase,Localization,No localization framework resource bundles or string externalization,Xbox certification failure - requires localization for global markets,Implement comprehensive localization framework with string resources,Active,High,9,Xbox global certification blocker
STEP22-CRIT-002,22,Localization and Globalization,Critical,Hardcoded English Strings,Source/PlayFabGameSave/Source/Types/FileFolderSetTypes.h:11,Localization,Filename hardcoded without localization consideration,Potential conflicts in non-Latin filename systems,Use Unicode-safe filename generation and validation,Active,Medium,5,International filename compatibility issue
STEP22-HIGH-001,22,Localization and Globalization,High,Time and Date Formatting Limitations,Source/PlayFabGameSave/Source/Generated/InternalPFGameSaveTypes.h:248,Localization,Raw time_t usage without locale-aware formatting,Timestamps not formatted for different regional preferences,Implement locale-aware time formatting using Windows NLS APIs,Active,Medium,6,Regional formatting compliance missing
STEP22-HIGH-002,22,Localization and Globalization,High,No Text Direction Support,Throughout codebase UI-related components,Localization,No provisions for RTL Right-to-Left text support,Cannot support Arabic Hebrew or other RTL languages properly,Implement BiDi bidirectional text support for UI components,Active,High,7,RTL language support missing completely
STEP22-MED-001,22,Localization and Globalization,Medium,String Encoding Assumptions,Throughout codebase using std::string,Localization,Assumes UTF-8 encoding without explicit validation,Potential corruption with non-UTF-8 input,Add explicit UTF-8 validation and conversion utilities,Active,Medium,5,Unicode handling assumptions risky
STEP23-CRIT-001,23,Accessibility and Inclusive Design,Critical,Complete Absence of Xbox Accessibility Guidelines Compliance,SDK-wide analysis - no accessibility code found,Accessibility,Zero accessibility features required for Xbox certification,Automatic Xbox certification failure - XAG compliance mandatory,Implement comprehensive XAG-compliant accessibility framework,Active,High,9,Xbox certification failure guaranteed
STEP23-CRIT-002,23,Accessibility and Inclusive Design,Critical,No Assistive Technology Integration,Source/PlayFabGameSave/Include/playfab/gamesave/PFGameSaveFilesUi.h,Accessibility,UI callback system has no assistive technology hooks,Users with disabilities cannot use the SDK effectively,Add comprehensive assistive technology APIs and compatibility,Active,High,9,Disability discrimination through inaccessibility
STEP23-CRIT-003,23,Accessibility and Inclusive Design,Critical,Keyboard Navigation Not Supported,UI callback system - no keyboard navigation infrastructure,Accessibility,No keyboard navigation support for UI decision points,Keyboard-only users cannot interact with game save UI,Add keyboard navigation APIs and focus management,Active,High,8,Keyboard accessibility completely missing
STEP23-HIGH-001,23,Accessibility and Inclusive Design,High,No Error Message Accessibility,Source/PlayFabGameSave/Source/Generated/GameSave.cpp,Accessibility,Error messages not structured for screen reader consumption,Users with visual impairments cannot understand error states,Add structured error announcement system for assistive tech,Active,Medium,6,Error accessibility missing for vision impaired
STEP23-HIGH-002,23,Accessibility and Inclusive Design,High,No Timeout Control or User Agency,Async operation system - no timeout customization,Accessibility,XAsyncBlock operations have no accessibility timeout controls,Users with disabilities may not have sufficient time to respond,Add configurable timeout and pause/resume functionality,Active,Medium,7,Timing accessibility controls missing
STEP23-HIGH-003,23,Accessibility and Inclusive Design,High,Visual Accessibility Not Addressed,UI callback system - no visual accessibility features,Accessibility,No color contrast scaling or visual accessibility considerations,Users with visual impairments cannot effectively use UI,Implement visual accessibility options and high contrast support,Active,High,7,Visual accessibility completely unaddressed
STEP24-CRIT-001,24,Telemetry and Analytics,Critical,Missing User Consent Management,Source/PlayFabGameSave/Source/Common/GameSaveTelemetryManager.cpp:11-50,Privacy,Telemetry collection automatically enabled without user consent,Privacy regulation violations GDPR Article 6 CCPA,Implement explicit user consent flow with granular options,Active,High,8,GDPR CCPA privacy violation critical
STEP24-CRIT-002,24,Telemetry and Analytics,Critical,No Data Retention Policy Implementation,Source/PlayFabGameSave/Source/Common/GameSaveTelemetryManager.h:1-324,Privacy,No automated data deletion or retention management,Indefinite data retention violates privacy regulations,Implement configurable retention periods and automated deletion,Active,High,8,Privacy regulation violation indefinite storage
STEP24-CRIT-003,24,Telemetry and Analytics,Critical,Missing Opt-Out Mechanisms,Complete telemetry system implementation,Privacy,No mechanism for users to disable or opt out of telemetry,Violates GDPR Article 7 withdrawal of consent and user rights,Implement comprehensive opt-out system with runtime disable,Active,High,8,User privacy rights violation no control
STEP24-HIGH-001,24,Telemetry and Analytics,High,Insufficient Data Anonymization,Source/PlayFabGameSave/Source/Common/GameSaveTelemetryManager.cpp:55-70,Privacy,User identifiers transmitted without anonymization,PII exposure in telemetry data enables user tracking,Implement data anonymization with salted hashing for identifiers,Active,Medium,6,PII exposure in telemetry data
STEP24-HIGH-002,24,Telemetry and Analytics,High,No Real-Time Monitoring Infrastructure,Telemetry system architecture,Operations,No real-time monitoring alerting or operational dashboards,Limited operational visibility and delayed issue detection,Implement real-time telemetry streaming and alerting infrastructure,Active,Medium,7,Operational monitoring infrastructure missing
STEP24-MED-001,24,Telemetry and Analytics,Medium,Limited Performance Monitoring Granularity,Source/PlayFabGameSave/Source/Common/GameSaveTelemetryManager.h:154-200,Operations,Basic performance metrics without detailed analysis,Limited ability to diagnose performance bottlenecks,Expand performance metrics with detailed latency breakdowns,Active,Medium,5,Performance monitoring insufficient detail
STEP25-CRIT-001,25,Final Recommendations and Summary,Critical,Authentication Race Condition Fix Required,Source/PlayFabGameSave/Source/Common/GameSaveGlobalState.cpp:86-95,Security,Thread-unsafe token management enabling session hijacking,Session hijacking vulnerability security breach risk,Implement thread-safe authentication with atomic operations,Active,High,8,Critical security vulnerability immediate fix required
STEP25-CRIT-002,25,Final Recommendations and Summary,Critical,Privacy Compliance Implementation Required,Source/PlayFabGameSave/Source/Common/GameSaveTelemetryManager.cpp,Privacy,No GDPR CCPA compliance mechanisms implemented,Regulatory fines market access restriction,Implement user consent data retention and privacy controls,Active,High,9,Privacy regulation compliance mandatory for markets
